{
  "schemaVersion": "1.0",
  "catalogVersion": "1.0",
  "title": "Example Approved Model and Provider Catalog",
  "owner": "Example Model Governance Authority",
  "lastReviewed": "2026-08-10",
  "entries": [
    {
      "id": "MPC-EXAMPLE-INSTRUCTION-001",
      "provider": "example-provider",
      "modelId": "example-instruction-model",
      "modelVersion": "2026-07-15",
      "purpose": "Classificação de intenção, síntese grounded e preparação de respostas internas.",
      "hosting": "managed",
      "status": "approved",
      "versionPinned": true,
      "dataUse": "no-training",
      "allowedDataClasses": [
        "public",
        "internal"
      ],
      "allowedRegions": [
        "example-region"
      ],
      "allowedRiskTiers": [
        "T1",
        "T2"
      ],
      "evaluationRef": "examples/evaluation-report.example.md",
      "reviewExpiresAt": "2026-11-01",
      "exitStrategy": "Fail closed e substituir somente após avaliação de equivalência aprovada.",
      "limitations": [
        "Não possui autoridade para executar mudanças",
        "Pode gerar conteúdo incorreto"
      ]
    },
    {
      "id": "MPC-EXAMPLE-REASONING-002",
      "provider": "example-provider",
      "modelId": "example-reasoning-model",
      "modelVersion": "2026-07-20",
      "purpose": "Triagem de elegibilidade com rationale recuperável e citação de regra aplicada.",
      "hosting": "managed",
      "status": "conditional",
      "versionPinned": true,
      "dataUse": "no-training",
      "allowedDataClasses": [
        "public",
        "internal",
        "confidential"
      ],
      "allowedRegions": [
        "example-region"
      ],
      "allowedRiskTiers": [
        "T2",
        "T3"
      ],
      "evaluationRef": "examples/evaluation-report.example.md",
      "reviewExpiresAt": "2026-11-01",
      "exitStrategy": "Fail closed para triagem manual; substituição exige avaliação de equivalência por slices.",
      "limitations": [
        "Não decide elegibilidade; prepara recomendação para decisão humana",
        "Desempenho por slice precisa ser reavaliado a cada mudança de versão",
        "Condicional: uso limitado a processos com contestação disponível"
      ],
      "conditionRefs": [
        "examples/cases/benefits-eligibility-triage/release-manifest.json"
      ]
    }
  ]
}
